{
  "algorithm": "EdDSA",
  "authority": "urn:concordia:authority:jcs",
  "condition": {
    "": "private-use",
    "😀": "smile"
  },
  "expires_at": "2026-05-21T00:00:00Z",
  "issued_at": "2026-05-14T00:00:00Z",
  "issuer": "did:web:issuer.example#key-1",
  "metadata": {
    "issuer_public_key_b64": "14Jm58cqv1UuS6hzzWHLldVHyKrdqgnWHTvx7zhltM0="
  },
  "predicate_id": "urn:concordia:predicate:pred_jcs_001",
  "references": [],
  "signature": "YkGbJLjFJBXLY7j4BV_9mEh_rNLWsIgWrOD7i0cJWMJyHPY5Wmqy7BcppkmYjVaPa2IVkW9KGar8p9a9uWAtCg==",
  "status": "active",
  "subject": "did:web:subject.example#agent",
  "type": "urn:concordia:predicate-type:jcs_edge:v1"
}
